{
  "request_id": "REQ-001",
  "protocol_version": "1.0",
  "profile": "standard",
  "context": "The signup endpoint currently returns HTTP 500 when an already-registered email is submitted.",
  "problem": "Duplicate signup attempts are treated as server failures instead of a bounded conflict outcome.",
  "source_of_truth": [
    {
      "kind": "commit",
      "ref": "repository main branch",
      "identity": "example-base-sha"
    },
    {
      "kind": "production-behaviour",
      "ref": "POST /signup duplicate-email flow",
      "identity": "observed-before-change"
    }
  ],
  "in_scope": [
    "duplicate-email signup response",
    "signup service duplicate guard"
  ],
  "out_of_scope": [
    "authentication provider",
    "pricing",
    "database schema"
  ],
  "acceptance_criteria": [
    {
      "id": "AC-1",
      "observation_scope": "POST /signup with an email already present in the user store",
      "expected_outcome": "The API returns HTTP 409 and the user count does not increase.",
      "verification": "Run the duplicate-email integration fixture and compare user count before and after the request.",
      "valid_alternatives": [],
      "indeterminate_when": [
        "The test fixture cannot establish the pre-request user count."
      ]
    }
  ],
  "verification_evidence": [
    {
      "id": "EV-1",
      "kind": "integration-test",
      "required": true,
      "how": "Duplicate-email integration fixture exits successfully and records HTTP 409 plus unchanged user count."
    },
    {
      "id": "EV-2",
      "kind": "build",
      "required": true,
      "how": "Repository build completes successfully at the reviewed head SHA."
    }
  ],
  "risks": [
    "A broad duplicate guard could incorrectly reject legitimate new users."
  ],
  "unknowns": [],
  "approval_authority": [
    "repository maintainer"
  ],
  "publication_gate": {
    "state": "READY_WHEN",
    "conditions": [
      "AC-1 evidence is collected at the reviewed head SHA.",
      "Required verification evidence is green."
    ]
  },
  "assumptions": [
    "The duplicate-email fixture represents the current persistence semantics."
  ],
  "reversibility": "The change can be reverted as one isolated service-layer commit.",
  "data_privacy": "Fixtures use synthetic email addresses only."
}
